{
  "id": "food-delivery-backend",
  "title": "Post-Course Portfolio: Food Delivery Backend",
  "descriptionMarkdown": "# Food Delivery Backend\n\n## Position in the curriculum\n\nPost-course portfolio: build after the E-commerce Backend, whose checkout/inventory and idempotency patterns this project extends into a longer, multi-actor order lifecycle (customer, restaurant, courier) instead of a single buyer-seller transaction.\n\n## What is graded, and what is external\n\nThis project has a dedicated, automatically-graded checkpoint: **`delivery-state-machine-checkpoint`** (\"Multi-actor delivery state machine\"), a pure in-memory `DeliveryStateMachine.run(String input)` program implementing exactly the `PLACED -> ACCEPTED -> READY -> PICKED_UP -> DELIVERED` (or `PLACED -> CANCELLED`) transition core, with every transition gated to a specific actor. Passing its hidden tests proves your state machine's transition and authorization rules are correct, independent of any real HTTP layer or database.\n\nWiring this logic to real restaurants, menus, live item availability, and courier assignment by proximity is external and self-reviewed.\n\n## Architecture overview\n\n```text\nOrderController                <- POST /orders, /orders/{id}/accept, /assign, /pickup, /deliver, /cancel\nOrderService                    <- your checkpoint's actor-gated transition rules, reshaped as a Spring bean\nRestaurant / MenuItem (JPA entities)   <- MenuItem carries an availability flag and a limited quantity\nOrder (JPA entity)               <- customer, restaurant, courier, status, line items, @Transactional boundary\nCourier (JPA entity)\n```\n\n## Build it as vertical slices\n\n1. **Slice 1 — port the checkpoint logic into a service.** Carry your actor-gated transition rules into `OrderService`, unit tests unchanged, operating on a real `Order` entity's status field instead of an in-memory map.\n2. **Slice 2 — order placement with an availability check.** Validate every line item's menu availability inside the same transaction that creates the order; reject the whole order if any item is unavailable, leaving no partial order row.\n3. **Slice 3 — the restaurant-facing transitions.** `accept`/`reject` and `assign` (courier), each checked against the actor's identity from the authenticated request, not a request body field.\n4. **Slice 4 — the courier-facing transitions.** `pickup` and `deliver`, restricted to the courier assigned to that specific order — reuse the object-level authorization pattern from the Authentication project.\n5. **Slice 5 — limited-quantity concurrency.** Add a limited-quantity menu item and confirm two near-simultaneous orders for its last unit cannot both succeed.\n\n## Common pitfalls\n\n- **Trusting a request body field for \"who is performing this action\" instead of the authenticated caller's identity.** Every transition's actor check must come from the security context, exactly as the checkpoint's own actor parameter models it.\n- **Checking item availability before the transaction starts, then creating the order in a separate step.** A concurrent order could slip in between the check and the write; check and create inside one transaction.\n- **Allowing a courier to act on an order they were never assigned to.** This is an object-level authorization gap, not just a missing role check.\n- **Letting an invalid transition silently succeed instead of returning a clear rejection.** Mirror the checkpoint's own contract: an invalid transition changes nothing and reports an error, it never partially applies.\n\n## How to self-test what the checkpoint cannot reach\n\n- Walk one order through its full valid lifecycle as three different authenticated identities in sequence, confirming each transition succeeds only for its correct actor.\n- Attempt every invalid transition (wrong actor, wrong current state, both) against a fresh order and confirm each is rejected with the order's state unchanged.\n- Fire two near-simultaneous orders for the last unit of a limited-quantity item and confirm only one is accepted.\n\n## Required evidence\n\n- A full state-machine test suite covering every valid transition and at least five specific invalid ones (wrong actor, wrong current state, or both).\n- A test confirming an order for a now-unavailable menu item is rejected inside the same transaction that would have created it, with no partial order row left behind.\n- An authorization test confirming a courier cannot see or act on an order not assigned to them.\n- A concurrency test where two orders are placed for the last available unit of a limited-quantity menu item, confirming only one succeeds.\n- A written diagram of the full state machine, with each transition labeled by the actor permitted to trigger it.\n\n## Review and completion\n\nA reviewer walks an order through its full lifecycle as three different authenticated identities in sequence (customer places, restaurant accepts, courier picks up and delivers), then creates a second order and attempts an invalid transition as the wrong actor at each state, expecting a specific, correctly-attributed rejection every time rather than a generic error.",
  "learningObjectives": [
    "Complete the graded multi-actor delivery state machine checkpoint and carry its verified transition rules into a real, authenticated Spring Boot service",
    "Validate a business precondition (item availability) inside the same transaction that depends on it",
    "Prevent a limited-quantity race across concurrent orders with a database-enforced guarantee",
    "Design and test authorization scoped to a specific assignment (this courier's assigned orders only)",
    "Document a state machine's transitions and their permitted actors as a reviewable artifact"
  ],
  "checkpointExerciseIds": [
    "delivery-state-machine-checkpoint"
  ]
}
