{
  "id": "url-shortener",
  "title": "Post-Course Portfolio: URL Shortener",
  "descriptionMarkdown": "# URL Shortener\n\n## Position in the curriculum\n\nThis belongs to the post-course portfolio catalog: build it after finishing the full 25-chapter curriculum, including the final capstone. It is the simplest entry in the catalog and a good first Spring Boot project, since it needs exactly one entity and no relationships.\n\n## What is graded, and what is external\n\nThis project has a dedicated, automatically-graded checkpoint: **`url-shortener-checkpoint`** (\"Short code allocator\"), a pure in-memory `ShortenerCore.run(String input)` program implementing exactly the allocate/resolve/hit-count decision core, using a simple deterministic sequential numbering scheme so it is fully testable without a database. Passing its hidden tests proves your allocation and lookup logic is correct.\n\nThe real Spring Boot service — HTTP endpoints, a JPA-backed unique short code, a redirect response — is external and self-reviewed against the Required Evidence below. The sandbox cannot start a web server or hold a database connection open across requests, so the checkpoint isolates the one part it can grade precisely: the allocation and lookup rules.\n\n## Architecture overview\n\n```text\nLinkController (REST adapter)     <- @PostMapping /api/links, @GetMapping /{code}\nLinkService                       <- your checkpoint logic, reshaped as a Spring bean\nLink (JPA entity)                 <- id, code (UNIQUE), longUrl, hitCount\nCreateLinkRequest / LinkResponse  <- DTOs, kept separate from the entity\n```\n\n## Build it as vertical slices\n\n1. **Slice 1 — port the checkpoint logic into a service bean.** Move your `ShortenerCore` logic into a constructor-injected `LinkService`, backed initially by an in-memory map, with unit tests carried over unchanged.\n2. **Slice 2 — the create endpoint.** `POST /api/links` with a `@Valid` `CreateLinkRequest` (non-blank URL, max length), returning `201 Created` with the generated code.\n3. **Slice 3 — persistence with a real unique constraint.** Swap the in-memory map for a JPA repository; add a migration creating the `link` table with `code` as `UNIQUE`. Confirm a `@DataJpaTest` proves uniqueness is enforced by the database, not just your code.\n4. **Slice 4 — the redirect endpoint.** `GET /{code}` returns `302 Found` with a `Location` header, or `404` for an unknown code; increment the hit counter atomically on every successful redirect.\n5. **Slice 5 — stats endpoint.** `GET /api/links/{code}/stats` returns the current hit count.\n\n## Common pitfalls\n\n- **Generating a \"random-looking\" code with no uniqueness guarantee.** Either use a scheme with a real uniqueness proof (a sequential id encoded in base62, or a UUID with a retry-on-collision loop) and back it with a database `UNIQUE` constraint regardless.\n- **Serializing the JPA `Link` entity directly as the response.** Return a dedicated `LinkResponse` DTO; the entity should never appear in an HTTP response body.\n- **Incrementing the hit counter with a read-then-write in application code.** Under concurrent redirects this loses updates; use an atomic database update (`UPDATE link SET hit_count = hit_count + 1 WHERE code = ?`) or a `@Query` with a native increment.\n- **Forgetting to validate the URL's length and shape before accepting it.** An unbounded URL string is exactly the kind of unvalidated input Chapter 23 warns against.\n\n## How to self-test what the checkpoint cannot reach\n\n- Use `curl` to exercise the full flow: `curl -X POST .../api/links -d '{\"longUrl\":\"...\"}'`, then `curl -i .../{code}` and confirm the `302`/`Location` header, then `curl .../api/links/{code}/stats`.\n- Fire many concurrent redirect requests at the same code (a simple shell loop with `&` is enough) and confirm the final hit count matches the request count exactly — this is where a naive read-then-write counter reveals itself.\n- Submit a malformed or oversized URL and confirm a `400` with a structured error body, never a stack trace.\n\n## Required evidence\n\n- A `@DataJpaTest` for the repository's uniqueness constraint and lookup-by-code query.\n- A `@WebMvcTest` for the controller's validation behavior (a blank or malformed URL returns 400 with a structured error body).\n- A migration (Flyway or Liquibase) creating the mapping table with its unique constraint, applied through the migration tool, never by hand.\n- A concurrency test firing many simultaneous redirects at the same code and confirming the click counter's final value is exactly correct, not undercounted by a lost update.\n- A README with the exact commands to build, migrate, and run the service from a clean checkout.\n\n## Review and completion\n\nA reviewer submits the same long URL twice and asks whether your design produces the same short code both times or two different ones, and to justify the choice. They then submit a deliberately malformed URL and a URL far past your declared length limit, expecting a clear 400 response with no stack trace ever reaching the client.",
  "learningObjectives": [
    "Complete the graded short-code-allocator checkpoint and carry its verified logic into a real Spring Boot REST resource",
    "Enforce uniqueness with a real database constraint rather than an application-only check",
    "Use the correct HTTP status and header for a redirect versus a not-found lookup",
    "Increment a shared counter atomically at the database level rather than with a lost-update-prone read-then-write",
    "Write and run @WebMvcTest and @DataJpaTest slices for the same feature"
  ],
  "checkpointExerciseIds": [
    "url-shortener-checkpoint"
  ]
}
