{
  "id": "milestone-6",
  "title": "Milestone 6: Chapters 16-18",
  "descriptionMarkdown": "Consolidate **Reflection, Annotations, Class Loading, and Bytecode**, **Logging, Testing, and Debugging**, **SQL and JDBC** in a small offline Java program. Review the reading lessons, complete each chapter assessment, and use the checkpoint as a clean, explainable portfolio snapshot.",
  "learningObjectives": [
    "Apply and explain the key contracts from Reflection, Annotations, Class Loading, and Bytecode",
    "Apply and explain the key contracts from Logging, Testing, and Debugging",
    "Apply and explain the key contracts from SQL and JDBC"
  ],
  "checkpointExerciseIds": [
    "m18-project-checkpoint"
  ]
}
