{
  "id": "inventory-stock-system",
  "title": "Portfolio Extra: Inventory / Stock Management System",
  "descriptionMarkdown": "# Inventory / Stock Management System\n\n## Position in the curriculum\nBuild this once you have completed Chapters 12 through 15 (files/NIO/date-time/regex/serialization, lambdas and Optional, stream pipelines, and testing/debugging/logging). It intentionally does not duplicate Phase 3's durable expense reporter: that project is about safe snapshotting and monthly aggregation of a transaction log, while this one is about stock-level business rules (reorder points, supplier lead time, stock movements) expressed as stream pipelines over structured records.\n\n## Already-proven foundation\nPhase 3's checkpoint already proved you can validate dated records and produce chronologically ordered aggregate reports without depending on the real clock. This project applies the same discipline to inventory movements instead of expenses, and adds streams as the primary tool for deriving business reports rather than manual loops.\n\n## Project scope\nModel a `StockItem` (SKU, description, quantity on hand, reorder threshold, unit cost) and a `StockMovement` (SKU, delta, reason, timestamp) as immutable records. Business rules: a movement that would drive quantity negative is rejected without mutating state; a `ReorderReport` (built with the Streams API, not manual loops) lists every item at or below its reorder threshold, sorted by how far below threshold it is; a `ValuationReport` sums quantity times unit cost, grouped by a supplier field, using `Collectors.groupingBy`. Persist the current stock levels and full movement history to a versioned, UTF-8, line-oriented file format, writing to a temporary file and atomically replacing the previous one on every save (exactly Phase 3's snapshot-safety pattern, applied here). Validate SKU format with a bounded regex, and reject an oversized or malformed input file explicitly rather than crashing.\n\n## Required evidence\n- A boundary table for a movement that exactly zeroes out stock, one that would go negative, and one for a SKU that does not exist.\n- Stream pipeline tests for the reorder and valuation reports against an empty inventory, a single supplier, and multiple suppliers with ties.\n- A filesystem test proving a failed or interrupted save leaves the previous valid snapshot intact and readable.\n- A regex test suite for the SKU format including near-miss strings that should be rejected.\n- A structured log entry for a rejected movement that includes the SKU and reason without leaking any other movement's data.\n\n## Review and completion\nA reviewer supplies a corrupted mid-file snapshot and a batch of movements including one negative-stock attempt, and asks you to trace exactly which operations succeeded, which were rejected, and why the file on disk still reflects only valid state. Explain why the reports are built as pure functions over an immutable movement list rather than mutating running totals in place. No database or framework is required; this is a standard-library, file-backed exercise.",
  "learningObjectives": [
    "Express business reports as stream pipelines using map/filter/sorted/groupingBy rather than manual loops",
    "Protect a numeric invariant (non-negative stock) against every code path that could violate it",
    "Apply the atomic-write, versioned-snapshot pattern to a second, differently-shaped domain",
    "Validate structured identifiers with a bounded regular expression and test its edge cases directly",
    "Log a rejected operation's cause without leaking unrelated record data"
  ],
  "checkpointExerciseIds": [
    "m15-phase-project"
  ]
}
