{
  "id": "booking-reservation-core",
  "title": "Portfolio Extra: Booking / Reservation System (Core)",
  "descriptionMarkdown": "# Booking / Reservation System (Core)\n\n## Position in the curriculum\n\nBuild this once you have completed Chapters 17 through 20 (concurrency, networking/HTTP/JSON, relational databases and JDBC, and architecture/SOLID/patterns). It deliberately has no REST layer yet — that arrives if you later revisit this domain in the post-course catalog once Spring is available. It does not duplicate Phase 4's persistent modular service: Phase 4 idempotently applies already-decided events, while this project's core problem is preventing two concurrent bookings from double-allocating the same resource in the first place.\n\n## What is graded, and what is external\n\nThis project has a dedicated, automatically-graded checkpoint: **`resource-booking-checkpoint`** (\"Resource slot booking engine\"), a pure in-memory `BookingEngine.run(String input)` program implementing exactly the double-booking-prevention and ownership-checked-cancellation invariant. Passing its hidden tests proves your sequential decision logic is correct.\n\n**Genuine concurrent-request safety cannot be graded by a deterministic, single-threaded sandbox test** — that specific guarantee is exactly what the Required Evidence's two-thread test, run on your own machine against a real database, is for. This is not a shortcut around concurrency; it is an honest acknowledgment that the checkpoint proves your *decision rules* are right, while a real database constraint plus a real multi-threaded test proves those rules actually *hold under contention*, which only genuine concurrent execution can demonstrate.\n\n## Architecture overview\n\n```text\nBookingEngine (checkpoint logic)  <- reshape into a domain service once persistence is added\nResource (record)                  <- resourceId, name\nBooking (entity, once persisted)   <- resourceId, slot, customerId, version (for optimistic locking)\nJdbcBookingRepository              <- UNIQUE constraint on (resource_id, slot) enforces the invariant at the database level\n```\n\n## Build it as vertical slices\n\n1. **Slice 1 — in-memory engine with tests.** Port your checkpoint logic into a `BookingEngine` class with `book`/`cancel`/`status` methods, backed by a `Map<String, String>`. This proves the sequential decision rules in isolation.\n2. **Slice 2 — a real schema with a real constraint.** Create a `bookings` table with a `UNIQUE (resource_id, slot)` constraint (Chapter 19), and a JDBC repository. Attempt a duplicate insert directly against the database and confirm it fails with a constraint violation, not just an application-level check.\n3. **Slice 3 — transactional multi-step booking.** Wrap \"reserve the slot, then charge a fee\" in one explicit transaction, and write a test that forces a failure between the two steps, confirming neither is committed.\n4. **Slice 4 — optimistic locking for reschedule/cancel.** Add a `version` column; a reschedule based on a stale read must be rejected, not silently overwritten, exactly as Chapter 24's `@Version` material (even without Spring yet) describes at the raw-JDBC level.\n5. **Slice 5 — bounded, deadline-aware execution.** Put the booking operation behind a bounded `ExecutorService` with a deadline, and cancel an attempt that exceeds it, confirming the caller's thread is never left blocked indefinitely.\n\n## Common pitfalls\n\n- **Relying only on an application-level check-then-insert for uniqueness.** Two concurrent requests can both pass the check before either inserts; only the database's own `UNIQUE` constraint closes this race.\n- **Testing concurrency with a `synchronized` block around the whole operation and calling that \"proof.\"** A single JVM's internal lock says nothing about two separate connections racing at the database; the actual proof is the constraint violation surfacing correctly under real concurrent load.\n- **Catching the constraint-violation exception generically and reporting a vague error.** Distinguish it specifically (by SQLState or vendor error code) so the caller gets a clear \"already booked\" response, not a generic 500.\n- **Forgetting the deadline applies to the whole operation, not the initial connection acquisition alone.** A slow query after the connection is acquired can still exceed the budget.\n\n## How to self-test what the checkpoint cannot reach\n\n- Run a genuine two-thread (or two-process) test that fires two conflicting booking attempts at the same resource/slot simultaneously, using real threads and a real database, and confirm exactly one succeeds.\n- Kill the JVM (or throw deliberately) between the reserve-slot and charge-fee steps and confirm, on restart, that neither change was committed.\n- Reduce the executor's deadline to something clearly too short, submit a slow booking attempt, and confirm it is cancelled rather than hanging the caller.\n\n## Required evidence\n\n- A two-thread integration test that fires two conflicting booking attempts at the same resource/slot simultaneously and confirms exactly one succeeds, backed by the database constraint, not a `synchronized` block alone.\n- A rollback test proving a failure partway through a multi-step booking (reserve the slot, then charge a fee) leaves neither change committed.\n- An optimistic-locking test where a reschedule based on a stale read is rejected with a specific, distinguishable outcome, not silently overwritten.\n- A deadline/cancellation test confirming a booking attempt that exceeds its time budget is cancelled and the caller's thread is not left blocked indefinitely.\n- A resolved dependency tree and a database migration script, applied through a versioned migration tool, not run by hand.\n\n## Review and completion\n\nA reviewer fires ten concurrent booking attempts at the same single-seat resource and slot, expects exactly one success and nine well-formed rejections (never nine crashes, never two successes), and asks you to point to the exact database constraint that makes the guarantee hold under real concurrency, not merely under a single-threaded test. External database and concurrency tests run outside LearnLocal's network-disabled exercise container.",
  "learningObjectives": [
    "Complete the graded resource-booking-engine checkpoint and carry its verified decision rules into a real, database-backed service",
    "Prevent a double-booking race with a real database constraint, not an application-only check-then-insert",
    "Wrap a multi-step booking operation in an explicit transaction with a verified rollback path",
    "Apply optimistic locking to reject a stale-read update instead of silently overwriting a concurrent change",
    "Write a genuine two-thread concurrency test that proves an invariant holds under real contention"
  ],
  "checkpointExerciseIds": [
    "resource-booking-checkpoint"
  ]
}
